<?xml version="1.0" encoding="UTF-8"?>
<!DOCTYPE Solution SYSTEM "deploy.dtd" >

<!--
  =============================================================================
    Sample configuration file for HPE Service Activator Solution deployment
  =============================================================================
-->

<!-- (c) Copyright 2008-2016 Hewlett Packard Enterprise Development LP -->

<!-- 
  INTRODUCTION
  =============================================================================
    This sample file demonstrates how write a "deploy.xml" file that is used
    to specify how a solution, a patch, or a customization is to be deployed
    in the HPE Service Activator runtime system.
    
    The <File> element is used in several places throughout this file.  For
    convenience the <File> element allows the use of simple wild-cards (*) as
    well as recursive wild-cards (**).  For example, the **/*.class pattern
    matches all files with the "class" extension in all sub-directories.

    In all cases the "deploy" operation will fail if a file in the runtime
    system is subject to be overwritten, unless the <File> element's
    'overwrite' attribute is set to 'true'.
    
    The <File> element also has an optional attribute called 'solution' with
    the default value 'false'.  The 'solution' attribute is only applicable
    for patches and customizations.  If the 'solution' attribute is set to
    'true' the Deployment Manager will copy the file from the patch or
    customization directory to the solution directory and NOT to the HP
    Service Activator runtime system when the patch or customization is'
    deployed.  If set to 'false', the file will be copied to the solution
    directory AND to the HPE Service Activator runtime system.
    
    The <File> element can be used to delete files by setting the value of the
    optional attribute 'delete' to 'true'.  The 'delete' attribute is only
    supported for patches and customizations.  (I.e. solutions can not use the
    'delete' attribute.)
    
    Finally, the <File> element has an optional attribute called 'executable'
    with the default value 'false'.  Setting this attribute to 'true' will
    cause the Deployment Manager to set the 'execute' bit after the file has
    been copied to the desired location.  The 'executable' attribute will not
    have an effect on Microsoft Windows systems.    
    
  THE SOLUTION DIRECTORY
  =============================================================================
    In order to use HPE Service Activator's built-in mechanisms for managing
    solution separation, all solutions must be located in the directory
    $ACTIVATOR_OPT/solutions/<SolutionName>.  The HPE Service Activator solution
    directory is structured as follows:
    
      <SolutionName>/
                    |-3rd-party/
                    |          |-classes/
                    |          |-lib/
                    |-bin/
                    |-CT/
                    |-docs/
                    |-etc/
                    |    |-config/
                    |    |       |-inventoryTree
                    |    |-data/
                    |    |-dc_tasks/
                    |    |-designer/
                    |    |         |-handlers/
                    |    |         |-nodes/
                    |    |-nls/
                    |    |-scripts/
                    |    |-queue/
                    |    |-sql/
                    |    |-template_files/
                    |    |-tests/
                    |    |      |-messages/
                    |    |-umm/
                    |    |-web_services/
                    |    |-workflows/
                    |    |-xmaps/
                    |-install/
                    |-inventory/
                    |-lib/
                    |-plugins/
                    |-UI/
                    |-var/
                    |    |-dc/
                    |    |-log/
                    |    |-tmp/
    
    The recommended use of the directories is described in the following:
      
      <SolutionName>/3rd-party/
        This directory is typically used for Java classes and Java archives
        implementing custom workflow nodes and modules.  There are, however,
        no restrictions to the usage of this directory.
        
      <SolutionName>/bin/
        This directory can be used as a place holder for executable files 
        (binary files as well as shell scripts) that are used as part of the
        solution.  The files in this directory will *not* be deployed into the
        HPE Service Activator runtime system.
        
      <SolutionName>/CT/
        This directory is used for solution specific compound tasks.
      
      <SolutionName>/docs/
        This directory can be used for containing documentation for the
        solution.  Files in this directory will *not* be deployed into the HP
        Service Activator runtime system.
        
      <SolutionName>/etc/config/
        This directory should contain configuration files, DTD files, etc.
        that are specific for the solution.
        
      <SolutionName>/etc/config/inventoryTree/
        This directory is used for Inventory Tree definition files.
        
      <SolutionName>/etc/data/
        This directory is used for load data files.
        
      <SolutionName>/etc/dc_tasks/
        HPE Service Activator's Data Collector utility can be extended with
        custom tasks.  Solution specific data collection tasks can be added to
        this directory.  Custom data collection tasks are *not* deployed to the
        HPE Service Activator runtime system.
      
      <SolutionName>/etc/designer/
        If the solution uses custom workflow nodes and/or custom error/end
        handlers their XML specification can be added to this directory. Note
        that the Java implementation of custom nodes and handler need to be
        added to the 3rd-party directory.  Custom handlers must be added to the
        "handlers" directory whereas the custom handlers must be added to the
        "nodes/<SolutionName>" directory.  Custom nodes should never be added
        to the "nodes/builtin" directory.
        
      <SolutionName>/etc/nls/
        This directory can be used as a place holder for localized version of HP
        Service Activator resource bundles.
      
      <SolutionName>/etc/queues/
	This directory can contain XML files that can be used to create queues
        used in the Queuing Sub-system.

      <SolutionName>/etc/sql/
        This directory can be used for solution specific SQL files - for
        instance if a solution needs custom database tables, sequences, etc.
        Files located in this directory will *not* be deployed into the HP
        Service Activator runtime system.
      
      <SolutionName>/etc/scripts/
        Scripts that are to be executed by the Deployment Manager during a
        deploy or an undeploy operation must be located in this directory.
      
      <SolutionName>/etc/template_files/
        This directory typically contains Java template files (used by the Java
        node or the JavaRule node in the Workflow Manager), XML templates, XSL
        templates, etc.
      
      <SolutionName>/etc/tests/messages/
        This directory can be used for test messages that can be injected into
        the SocketListener module from the HPE Service Activator User Interface.
      
      <SolutionName>/etc/umm/
        This directory can contain XML files that can be used to create roles
        in HPE Service Activator and assign inventory trees, operation types,
        and branch types to roles.
      
      <SolutionName>/etc/web_services/
        This directory may contain XML files that define a web service
        interface to HPE Service Activator as well as WAR files (Web Archives)
        implementing web service interfaces.
      
      <SolutionName>/etc/workflows/
        All workflows in a solution should be located in this directory.
      
      <SolutionName>/etc/xmaps/
        All xmaps in a solution should be located in this directory.
      
      <SolutionName>/install/
        This directory is used internally by the Deployment Manager to keep
        track of the deployment state of a solution.  User's should not change
        anything in this directory.
      
      <SolutionName>/inventory/
        This directory is used for all inventory resource definition files in a
        solution and (if manual inventory deployment is used) for
        customizations to the inventory subsystem.
      
      <SolutionName>/lib/
        This directory can be used for Java classes, Java achieve files, etc.
        that are used by scripts located in the <SolutionName>/bin directory.
        Files located in this directory will *not* be deployed into the HP
        Service Activator runtime system.
      
      <SolutionName>/plugins/
        All plug-ins in a solution should be located in this directory.
      
      <SolutionName>/UI/
        All custom user interface components (HTML, JSPs, JavaScripts, etc.)
        should be located in this directory.
      
      <SolutionName>/var/
        This directory can be used for solution specific log files, temporary
        files etc.  Files located in this directory will *not* be deployed into
        the HPE Service Activator runtime system.
      
  THE PATCH / CUSTOMIZATION DIRECTORY
  =============================================================================
    The directory structure for patches and customizations is identical to that
    of a solution, except that the home directory is different.
    
    Patches must be located in the directory:
      $ACTIVATOR_OPT/solutions/<SolutionName>/patches/<PatchName>
    
    Customizations must be located in the directory:
      $ACTIVATOR_OPT/solutions/<CustomizationName>